### ISSUE TITLE
WebSocket Upgrade not sending Response

### ISSUE THREAD

**Issue by Abroxa** [fabiolb/fabio#447]
I have a problem getting the websocket part of a route to work. Here is my setup:

- Dockerized web app supporting HTTP and WS (on specific resource)
- Consul service tags for it: `urlprefix-sat-140-patched.applications.fme.lan/`
- This web app is scheduled by Nomad

The websocket connection works when accessing the web app directly, but it doesn't work when it is being used through fabio. It looks like the Upgrade response is not taken back to the client. Please see the attached screenshots of the browser's request headers for both direct and fabio-proxied access:

Direct Access:
![direct-access-cropped](https://user-images.githubusercontent.com/25658526/36478120-e8012844-1703-11e8-96bd-140b1d6c14df.png)

Fabio Access:
![fabio-access-cropped](https://user-images.githubusercontent.com/25658526/36478124-ec289510-1703-11e8-88e9-12157570dba9.png)

Fabio Routes:
![fabio-routes-cropped](https://user-images.githubusercontent.com/25658526/36478128-efa07b2c-1703-11e8-89f4-2d8d3054ea88.png)

Maybe I am doing something wrong, I am a fabio beginner, but at least I think I have read the relevant documentation. And as it is a tool with (almost) zero configuration overhead I did not need to read much to get most stuff up and running, so thank you for this great addition.

I also tried to add `proto=ws` to my `urlprefix-` service tag but that did not help.

Thanks for any help, fix or hint.

**Comment by magiconair** [comment]
That should work out of the box. Can you verify whether fabio forwards the request to the server (e.g. `tcpdump -i eth0 -A -s 1520 port 20314` or `ngrep -q -D eth0 port 20314` on the server itself?

**Comment by Abroxa** [comment]
This is strange, I do not get any output from tcpdump on `enp0s3` which is the interface for `10.0.2.15` on my VM. However, when I `tcpdump` interface `docker0` I can see the packets from the browser for the web app container. This is true for both direct and fabio access. Maybe this is somehow related to the Docker bridge network. Here is what `sudo tcpdump -i docker0 -A -s 1520 port 27181` receives (a bit truncated, this should be the interesting part and: ports have changed due to container restarts...):

```
GET /mlab4d4c4142/SegmentationAnnotationTool/null HTTP/1.1
Host: sat-140-patched.applications.fme.lan
User-Agent: Mozilla/5.0 (X11; Linux x86_64; rv:57.0) Gecko/20100101 Firefox/57.0
Accept: text/html,application/xhtml+xml,application/xml;q=0.9,*/*;q=0.8
Accept-Encoding: gzip, deflate
Accept-Language: en-US,en;q=0.5
Cache-Control: no-cache
Connection: keep-alive, Upgrade
Forwarded: for=10.0.2.15; proto=ws; by=172.17.0.3; httpproto=http/1.1
Origin: http://sat-140-patched.applications.fme.lan
Pragma: no-cache
Sec-Websocket-Extensions: permessage-deflate
Sec-Websocket-Key: aRP8Qa51fz7l6q3/8ntT2w==
Sec-Websocket-Version: 13
Upgrade: websocket
X-Forwarded-For: 10.0.2.15
X-Forwarded-Host: sat-140-patched.applications.fme.lan
X-Forwarded-Port: 80
X-Forwarded-Proto: http
X-Real-Ip: 10.0.2.15


14:57:38.284923 IP sat-140-patched.applications.fme.lan.27181 > 172.17.0.3.58992: Flags [.], ack 818, win 240, options [nop,nop,TS val 26095356 ecr 2428573482], length 0
E..4..@.@...
.......j-.p3.d..n.P.....I.....
.......*
14:57:38.296351 IP sat-140-patched.applications.fme.lan.27181 > 172.17.0.3.58992: Flags [P.], seq 1:335, ack 818, win 240, options [nop,nop,TS val 26095367 ecr 2428573482], length 334
E.....@.@...
.......j-.p3.d..n.P...........
../....*<!DOCTYPE HTML PUBLIC "-//IETF//DTD HTML 2.0//EN">
<html><head>
<title>502 Bad Gateway</title>
</head><body>
<h1>Bad Gateway</h1>
<p>The proxy server received an invalid
response from an upstream server.<br />
</p>
<hr>
<address>Apache/2.4.18 (Ubuntu) Server at sat-140-patched.applications.fme.lan Port 80</address>
</body></html>
```

So this apache web server is the internal web server of the web app. It has enabled `mod_proxy_wstunnel` meaning itself is another reverse proxy for the websocket connection due to historical reasons. Could that be a problem for fabio or the browser? Although it might be inefficient, the proxies actually should not care, I thought.

For completeness here is some more detailed information about my setup:

```
[daniel@manjaro-vm Jobs]$ ip address
1: lo: <LOOPBACK,UP,LOWER_UP> mtu 65536 qdisc noqueue state UNKNOWN group default qlen 1000
    link/loopback 00:00:00:00:00:00 brd 00:00:00:00:00:00
    inet 127.0.0.1/8 scope host lo
       valid_lft forever preferred_lft forever
    inet6 ::1/128 scope host 
       valid_lft forever preferred_lft forever
2: enp0s3: <BROADCAST,MULTICAST,UP,LOWER_UP> mtu 1500 qdisc fq_codel state UP group default qlen 1000
    link/ether 08:00:27:92:c1:2d brd ff:ff:ff:ff:ff:ff
    inet 10.0.2.15/24 brd 10.0.2.255 scope global dynamic noprefixroute enp0s3
       valid_lft 82534sec preferred_lft 82534sec
    inet6 fe80::77:7071:f9e:6bba/64 scope link noprefixroute 
       valid_lft forever preferred_lft forever
3: docker0: <BROADCAST,MULTICAST,UP,LOWER_UP> mtu 1500 qdisc noqueue state UP group default 
    link/ether 02:42:eb:88:9f:70 brd ff:ff:ff:ff:ff:ff
    inet 172.17.0.1/16 brd 172.17.255.255 scope global docker0
       valid_lft forever preferred_lft forever
    inet6 fe80::42:ebff:fe88:9f70/64 scope link 
       valid_lft forever preferred_lft forever
9: veth86ae636@if8: <BROADCAST,MULTICAST,UP,LOWER_UP> mtu 1500 qdisc noqueue master docker0 state UP group default 
    link/ether a2:fd:c1:27:bf:14 brd ff:ff:ff:ff:ff:ff link-netnsid 1
    inet6 fe80::a0fd:c1ff:fe27:bf14/64 scope link 
       valid_lft forever preferred_lft forever
13: vetheb7eba1@if12: <BROADCAST,MULTICAST,UP,LOWER_UP> mtu 1500 qdisc noqueue master docker0 state UP group default 
    link/ether 86:b5:cc:dd:a4:d1 brd ff:ff:ff:ff:ff:ff link-netnsid 0
    inet6 fe80::84b5:ccff:fedd:a4d1/64 scope link 
       valid_lft forever preferred_lft forever
```

```
[daniel@manjaro-vm Jobs]$ docker ps
CONTAINER ID        IMAGE               COMMAND                  CREATED             STATUS              PORTS                                                                                                NAMES
4d2b2daadfd3        c63a210d0c34        "/tini -- /usr/bin/s…"   17 minutes ago      Up 17 minutes       443/tcp, 10.0.2.15:27181->80/tcp, 10.0.2.15:27181->80/udp                                            worker-3810089d-73a9-5fff-e7e0-e7ee563009d9
4e04e3bb2d02        417d06d1888f        "/fabio -cfg /etc/fa…"   About an hour ago   Up About an hour    10.0.2.15:9998->9998/tcp, 10.0.2.15:9998->9998/udp, 10.0.2.15:80->9999/tcp, 10.0.2.15:80->9999/udp   balancer-b4171dad-947a-a6d7-06d5-7e80fe66456d
```
The first thing is the web app, the second container is fabio, both started by Nomad.

**Comment by Abroxa** [comment]
After thinking a bit longer about apache's message `The proxy server received an invalid
response from an upstream server.` I come to the conclusion that it means that within the setup of two WS proxies (1. fabio 2. apache mod_proxy_wstunnel) somehow make the request bad for the actual WS server endpoint. I will try to get the logs of this internal stuff if existing...

**Comment by Abroxa** [comment]
Ok, I debugged it using tcpdump within the container on the internal websocket server. To begin with, I am not sure whether it's fabio's fault, as everything works when fabio directly connects to this internal server. When there is an additional apache in between, things break. And I think it is somehow related to the additional header information.

Feel free to close this issue, but maybe you or someone else can comment on the reasons why the internal server does not accept the request.

Again, this the setup:
Within a Docker container, there is
- An internal websocket server (I think it's written in Qt or so) that does some remote rendering and streams it back, we call it *workerservice*
- An Apache that acts as frontend for the container, it ships the website and has a reverse proxy (mod_proxy_wstunnel) for the websocket connection that it redirects to the thing above

This is the tcpdump for `firefox->fabio->apache->workerservice`:
```
GET /mlab4d4c4142/SegmentationAnnotationTool/null HTTP/1.1
Host: 127.0.0.1:4114
User-Agent: Mozilla/5.0 (X11; Linux x86_64; rv:57.0) Gecko/20100101 Firefox/57.0
Accept: text/html,application/xhtml+xml,application/xml;q=0.9,*/*;q=0.8
Accept-Encoding: gzip, deflate
Accept-Language: en-US,en;q=0.5
Cache-Control: no-cache
Forwarded: for=10.0.2.15; proto=ws; by=172.17.0.3; httpproto=http/1.1
Origin: http://sat-140-patched.applications.fme.lan
Pragma: no-cache
Sec-Websocket-Extensions: permessage-deflate
Sec-Websocket-Key: dp9S5KzoVXY+hLVgUAh8jg==
Sec-Websocket-Version: 13
X-Forwarded-For: 10.0.2.15, 172.17.0.1
X-Forwarded-Host: sat-140-patched.applications.fme.lan, sat-140-patched.applications.fme.lan
X-Forwarded-Port: 80

08:17:05.537042 IP localhost.4114 > localhost.59830: Flags [.], ack 744, win 353, options [nop,nop,TS val 2582068373 ecr 2582068373], length 0
E..45d@.@..^...............jG[.....a.(.....
..<...<.
08:17:05.537051 IP localhost.59830 > localhost.4114: Flags [P.], seq 744:866, ack 1, win 342, options [nop,nop,TS val 2582068373 ecr 2582068373], length 122
E...N.@.@..^............G[.....j...V.......
..<...<.X-Forwarded-Proto: http
X-Real-Ip: 10.0.2.15
X-Forwarded-Server: 172.17.0.2
Upgrade: WebSocket
Connection: Upgrade
```
As you can see, the internal server already responds (probably drops the connection) although the request is not finished yet. I don't know why. It could have something to do with the additional headers.

This is the tcpdump for `firefox->fabio->workerservice`:
```
GET /mlab4d4c4142/SegmentationAnnotationTool/null HTTP/1.1
Host: sat-140-patched.applications.fme.lan:4114
User-Agent: Mozilla/5.0 (X11; Linux x86_64; rv:57.0) Gecko/20100101 Firefox/57.0
Accept: text/html,application/xhtml+xml,application/xml;q=0.9,*/*;q=0.8
Accept-Language: en-US,en;q=0.5
Accept-Encoding: gzip, deflate
Sec-WebSocket-Version: 13
Origin: http://sat-140-patched.applications.fme.lan
Sec-WebSocket-Extensions: permessage-deflate
Sec-WebSocket-Key: uiL6yTHOkNL6zsrAWwEHqA==
Connection: keep-alive, Upgrade
Pragma: no-cache
Cache-Control: no-cache
Upgrade: websocket


09:00:27.630351 IP 239cd1a9af10.4114 > 10.0.2.15.47728: Flags [.], ack 599, win 236, options [nop,nop,TS val 1215400654 ecr 2329613429], length 0
E..4q.@.@.......
......pK.....$Z.....H.....
Hq.....u
09:00:27.631456 IP 239cd1a9af10.4114 > 10.0.2.15.47728: Flags [P.], seq 1:139, ack 599, win 236, options [nop,nop,TS val 1215400656 ecr 2329613429], length 138
E...q.@.@.._....
......pK.....$Z...........
Hq.....uHTTP/1.1 101 WebSocket Protocol Handshake
Upgrade: WebSocket
Connection: Upgrade
Sec-WebSocket-Accept: dPaXiIz5P8Qmvu+6l8AiiJMDSTI=
```
Everything OK

For completeness, here are the dumps where fabio was not involved:

This is the tcpdump for `firefox->apache->workerservice`:
```
GET /mlab4d4c4142/SegmentationAnnotationTool/null HTTP/1.1
Host: 127.0.0.1:4114
User-Agent: Mozilla/5.0 (X11; Linux x86_64; rv:57.0) Gecko/20100101 Firefox/57.0
Accept: text/html,application/xhtml+xml,application/xml;q=0.9,*/*;q=0.8
Accept-Language: en-US,en;q=0.5
Accept-Encoding: gzip, deflate
Sec-WebSocket-Version: 13
Origin: http://10.0.2.15:21681
Sec-WebSocket-Extensions: permessage-deflate
Sec-WebSocket-Key: 3gXLMaDnE7FkBEX5tLMpHg==
Pragma: no-cache
Cache-Control: no-cache
X-Forwarded-For: 10.0.2.15
X-Forwarded-Host: 10.0.2.15:21681
X-Forwarded-Server: 172.17.0.2
Upgrade: WebSocket
Connection: Upgrade


08:22:43.613468 IP localhost.4114 > localhost.32890: Flags [.], ack 634, win 352, options [nop,nop,TS val 2582406449 ecr 2582406449], length 0
E..4..@.@.!!...........z.X....v....`.(.....
..e1..e1
08:22:43.614959 IP localhost.4114 > localhost.32890: Flags [P.], seq 1:139, ack 634, win 352, options [nop,nop,TS val 2582406450 ecr 2582406449], length 138
E.....@.@. ............z.X....v....`.......
..e2..e1HTTP/1.1 101 WebSocket Protocol Handshake
Upgrade: WebSocket
Connection: Upgrade
Sec-WebSocket-Accept: afbGHM7N8PpAhnmNDmUcbqg3ZCY=
```
Everything OK.

This is the tcpdump for `firefox->workerservice`:
```
GET /mlab4d4c4142/SegmentationAnnotationTool/null HTTP/1.1
Host: 10.0.2.15:4114
User-Agent: Mozilla/5.0 (X11; Linux x86_64; rv:57.0) Gecko/20100101 Firefox/57.0
Accept: text/html,application/xhtml+xml,application/xml;q=0.9,*/*;q=0.8
Accept-Language: en-US,en;q=0.5
Accept-Encoding: gzip, deflate
Sec-WebSocket-Version: 13
Origin: http://10.0.2.15:27382
Sec-WebSocket-Extensions: permessage-deflate
Sec-WebSocket-Key: Y5aAOWQDI/qTGM+Lnqbdjg==
Connection: keep-alive, Upgrade
Pragma: no-cache
Cache-Control: no-cache
Upgrade: websocket


09:02:10.405834 IP 239cd1a9af10.4114 > 10.0.2.15.48128: Flags [.], ack 551, win 235, options [nop,nop,TS val 1215503430 ecr 2329716205], length 0
E..4l.@.@.......
........M.V~.m......H.....
Hs.F....
09:02:10.406079 IP 239cd1a9af10.4114 > 10.0.2.15.48128: Flags [P.], seq 1:139, ack 551, win 235, options [nop,nop,TS val 1215503430 ecr 2329716205], length 138
E...l.@.@.......
........M.V~.m............
Hs.F....HTTP/1.1 101 WebSocket Protocol Handshake
Upgrade: WebSocket
Connection: Upgrade
Sec-WebSocket-Accept: S7EEsyKvKg+1XaJfToTb0lA0yck=
```
Everything OK.

**Comment by Abroxa** [comment]
It was a problem with the internal WebSocket server which had problems understanding `X-Forwarded-For` headers when there were multiple forwards (separated by comma). I turned them off using `ProxyAddHeaders Off` in the apache "middleware".

Thanks for the `tcpdump` suggestion, that worked great!
